{
  "schemaVersion": "ccd-ui-source-coverage/v1",
  "repository": "ichichuang/ccd",
  "counts": {
    "sourceEnforceable": 24,
    "assisted": 22,
    "schemaEnforced": 8,
    "humanReviewOnly": 14,
    "sourceCapable": 46,
    "permanentDispositions": 54,
    "humanDispositions": 14,
    "total": 68
  },
  "pageContractDeferrals": [
    "P2C-REQ-0006",
    "P2C-REQ-0028",
    "P2C-REQ-0065",
    "P2C-REQ-0067"
  ],
  "bindings": [
    {
      "ruleId": "CCD-UI-001",
      "originalDisposition": "permanent-rule",
      "scannerCategory": "source-enforceable-with-human-remainder",
      "finalEnforcement": "source-scanner-assisted-human-review",
      "detectorId": "PrimeVueComponentPriorityScanner",
      "module": "detectors/component-ownership.mjs",
      "evidence": "raw PrimeVue component reference with a closed project-wrapper equivalence",
      "languages": [
        "vue",
        "tsx"
      ],
      "scopeIds": [
        "APP_LAYOUTS",
        "APP_ROOTS",
        "APP_VIEWS",
        "SHARED_PRIME",
        "SHARED_UI"
      ],
      "ownerContextIds": [
        "OC-PRIME-ADAPTER",
        "OC-PRO-COMPONENT"
      ],
      "fixtureIds": [
        "CCD-UI-001-pass",
        "CCD-UI-001-fail",
        "SRC-CCD-UI-001-VALID",
        "SRC-CCD-UI-001-INVALID"
      ],
      "exceptionEligible": false,
      "confidence": "bounded",
      "humanRemainder": "judge semantic equivalence and wrapper suitability when the closed map cannot prove it",
      "pageContract": null,
      "messageId": "UI-SRC-001",
      "fingerprintKind": "component-reference"
    },
    {
      "ruleId": "CCD-UI-002",
      "originalDisposition": "permanent-rule",
      "scannerCategory": "source-enforceable",
      "finalEnforcement": "source-scanner-enforced",
      "detectorId": "PrimeVueComponentPriorityScanner",
      "module": "detectors/component-ownership.mjs",
      "evidence": "native element outside the structural allowlist",
      "languages": [
        "vue",
        "tsx"
      ],
      "scopeIds": [
        "APP_LAYOUTS",
        "APP_ROOTS",
        "APP_VIEWS",
        "SHARED_PRIME",
        "SHARED_UI"
      ],
      "ownerContextIds": [
        "OC-PRO-COMPONENT"
      ],
      "fixtureIds": [
        "CCD-UI-002-pass",
        "CCD-UI-002-fail",
        "SRC-CCD-UI-002-VALID",
        "SRC-CCD-UI-002-INVALID"
      ],
      "exceptionEligible": false,
      "confidence": "high",
      "humanRemainder": null,
      "pageContract": null,
      "messageId": "UI-SRC-002",
      "fingerprintKind": "native-element"
    },
    {
      "ruleId": "CCD-UI-003",
      "originalDisposition": "permanent-rule",
      "scannerCategory": "source-enforceable-with-human-remainder",
      "finalEnforcement": "source-scanner-assisted-human-review",
      "detectorId": "PrimeVueComponentPriorityScanner",
      "module": "detectors/component-ownership.mjs",
      "evidence": "native element with a closed PrimeVue equivalence",
      "languages": [
        "vue",
        "tsx"
      ],
      "scopeIds": [
        "APP_LAYOUTS",
        "APP_ROOTS",
        "APP_VIEWS",
        "SHARED_PRIME",
        "SHARED_UI"
      ],
      "ownerContextIds": [
        "OC-PRIME-ADAPTER",
        "OC-PRO-COMPONENT"
      ],
      "fixtureIds": [
        "CCD-UI-003-pass",
        "CCD-UI-003-fail",
        "SRC-CCD-UI-003-VALID",
        "SRC-CCD-UI-003-INVALID"
      ],
      "exceptionEligible": false,
      "confidence": "bounded",
      "humanRemainder": "decide whether an unmapped element has a suitable PrimeVue equivalent",
      "pageContract": null,
      "messageId": "UI-SRC-003",
      "fingerprintKind": "component-reference"
    },
    {
      "ruleId": "CCD-UI-004",
      "originalDisposition": "permanent-rule",
      "scannerCategory": "source-enforceable",
      "finalEnforcement": "source-scanner-enforced",
      "detectorId": "NativeControlScanner",
      "module": "detectors/component-ownership.mjs",
      "evidence": "forbidden native control element",
      "languages": [
        "vue",
        "tsx"
      ],
      "scopeIds": [
        "APP_LAYOUTS",
        "APP_ROOTS",
        "APP_VIEWS",
        "SHARED_PRIME",
        "SHARED_UI"
      ],
      "ownerContextIds": [
        "OC-PRO-COMPONENT",
        "OC-PROFORM-NATIVE"
      ],
      "fixtureIds": [
        "CCD-UI-004-pass",
        "CCD-UI-004-fail",
        "SRC-CCD-UI-004-VALID",
        "SRC-CCD-UI-004-INVALID"
      ],
      "exceptionEligible": false,
      "confidence": "high",
      "humanRemainder": null,
      "pageContract": null,
      "messageId": "UI-SRC-004",
      "fingerprintKind": "native-element"
    },
    {
      "ruleId": "CCD-UI-005",
      "originalDisposition": "permanent-rule",
      "scannerCategory": "source-enforceable",
      "finalEnforcement": "source-scanner-enforced",
      "detectorId": "EchartsOwnershipScanner",
      "module": "detectors/component-ownership.mjs",
      "evidence": "direct ECharts runtime reference outside chart ownership",
      "languages": [
        "vue",
        "ts",
        "tsx"
      ],
      "scopeIds": [
        "APP_ADAPTERS",
        "APP_VIEWS",
        "SHARED_CHARTS"
      ],
      "ownerContextIds": [
        "OC-CHART-RUNTIME"
      ],
      "fixtureIds": [
        "CCD-UI-005-pass",
        "CCD-UI-005-fail",
        "SRC-CCD-UI-005-VALID",
        "SRC-CCD-UI-005-INVALID"
      ],
      "exceptionEligible": false,
      "confidence": "high",
      "humanRemainder": null,
      "pageContract": null,
      "messageId": "UI-SRC-005",
      "fingerprintKind": "runtime-api-reference"
    },
    {
      "ruleId": "CCD-UI-006",
      "originalDisposition": "permanent-rule",
      "scannerCategory": "source-enforceable",
      "finalEnforcement": "source-scanner-enforced",
      "detectorId": "FeedbackAbstractionScanner",
      "module": "detectors/component-ownership.mjs",
      "evidence": "raw alert, confirmation or toast acquisition",
      "languages": [
        "vue",
        "ts",
        "tsx"
      ],
      "scopeIds": [
        "APP_ADAPTERS",
        "APP_LAYOUTS",
        "APP_PLUGINS",
        "APP_ROOTS",
        "APP_VIEWS",
        "SHARED_PRIME",
        "SHARED_UI"
      ],
      "ownerContextIds": [
        "OC-FEEDBACK-DIALOG"
      ],
      "fixtureIds": [
        "CCD-UI-006-pass",
        "CCD-UI-006-fail",
        "SRC-CCD-UI-006-VALID",
        "SRC-CCD-UI-006-INVALID"
      ],
      "exceptionEligible": false,
      "confidence": "high",
      "humanRemainder": null,
      "pageContract": null,
      "messageId": "UI-SRC-006",
      "fingerprintKind": "feedback-call"
    },
    {
      "ruleId": "CCD-UI-007",
      "originalDisposition": "permanent-rule",
      "scannerCategory": "source-enforceable",
      "finalEnforcement": "source-scanner-enforced",
      "detectorId": "FeedbackAbstractionScanner",
      "module": "detectors/component-ownership.mjs",
      "evidence": "direct feedback service construction or call",
      "languages": [
        "vue",
        "ts",
        "tsx"
      ],
      "scopeIds": [
        "APP_ADAPTERS",
        "APP_LAYOUTS",
        "APP_PLUGINS",
        "APP_ROOTS",
        "APP_VIEWS",
        "SHARED_PRIME",
        "SHARED_UI"
      ],
      "ownerContextIds": [
        "OC-FEEDBACK-DIALOG"
      ],
      "fixtureIds": [
        "CCD-UI-007-pass",
        "CCD-UI-007-fail",
        "SRC-CCD-UI-007-VALID",
        "SRC-CCD-UI-007-INVALID"
      ],
      "exceptionEligible": false,
      "confidence": "high",
      "humanRemainder": null,
      "pageContract": null,
      "messageId": "UI-SRC-007",
      "fingerprintKind": "feedback-call"
    },
    {
      "ruleId": "CCD-UI-008",
      "originalDisposition": "permanent-rule",
      "scannerCategory": "source-enforceable",
      "finalEnforcement": "source-scanner-enforced",
      "detectorId": "FeedbackAbstractionScanner",
      "module": "detectors/component-ownership.mjs",
      "evidence": "raw Dialog component outside approved wrapper ownership",
      "languages": [
        "vue",
        "tsx"
      ],
      "scopeIds": [
        "APP_ADAPTERS",
        "APP_LAYOUTS",
        "APP_PLUGINS",
        "APP_ROOTS",
        "APP_VIEWS",
        "SHARED_PRIME",
        "SHARED_UI"
      ],
      "ownerContextIds": [
        "OC-PRIME-ADAPTER",
        "OC-PRO-COMPONENT",
        "OC-FEEDBACK-DIALOG"
      ],
      "fixtureIds": [
        "CCD-UI-008-pass",
        "CCD-UI-008-fail",
        "SRC-CCD-UI-008-VALID",
        "SRC-CCD-UI-008-INVALID"
      ],
      "exceptionEligible": false,
      "confidence": "high",
      "humanRemainder": null,
      "pageContract": null,
      "messageId": "UI-SRC-008",
      "fingerprintKind": "component-reference"
    },
    {
      "ruleId": "CCD-UI-009",
      "originalDisposition": "permanent-rule",
      "scannerCategory": "source-enforceable-with-human-remainder",
      "finalEnforcement": "source-scanner-assisted-human-review",
      "detectorId": "PassThroughConflictScanner",
      "module": "detectors/primevue-customization.mjs",
      "evidence": "PrimeVue visual customization outside pass-through ownership",
      "languages": [
        "vue",
        "tsx"
      ],
      "scopeIds": [
        "APP_LAYOUTS",
        "APP_ROOTS",
        "APP_VIEWS",
        "SHARED_PRIME",
        "SHARED_UI"
      ],
      "ownerContextIds": [
        "OC-PRIME-ADAPTER",
        "OC-PRO-COMPONENT",
        "OC-PT-PRESET"
      ],
      "fixtureIds": [
        "CCD-UI-009-pass",
        "CCD-UI-009-fail",
        "SRC-CCD-UI-009-VALID",
        "SRC-CCD-UI-009-INVALID"
      ],
      "exceptionEligible": false,
      "confidence": "bounded",
      "humanRemainder": "classify dynamic customization and whether the change is visual",
      "pageContract": null,
      "messageId": "UI-SRC-009",
      "fingerprintKind": "pt-structure"
    },
    {
      "ruleId": "CCD-UI-010",
      "originalDisposition": "permanent-rule",